{
  "schemaVersion": 1,
  "domain": "ryanl.in",
  "controlSubdomain": "deploy",
  "originIPv4": "23.169.184.53",
  "cloudflareZoneId": "0a50a121d5374b8a864a31a8ec4e12a1",
  "platformRepository": "Deploy-ryanl-in/personal-paas",
  "platformSha": "5bd7960c2f4cc1fa0a8b5cc23a4e264a13ba686d",
  "owners": [
    {
      "id": "93820487",
      "login": "RyanStanLin",
      "type": "User"
    },
    {
      "id": "337720882",
      "login": "Deploy-ryanl-in",
      "type": "Organization"
    }
  ],
  "repositoryAllowlist": [],
  "previousWorkflowShas": [],
  "repositoryVerification": "job-token-or-app"
}
